{
  "schema_version": "3.0",
  "document": "Stressszenarien",
  "as_of": "2026-09-24",
  "conventions": {
    "rates": "Zinsklassen in Prozentpunkten Rendite; Kursänderung = Duration × Renditeänderung, STIR: Punkte = Prozentpunkte / Preis",
    "others": "Prozent des Preises, ohne Vorzeichen (ungünstigste Richtung)",
    "d1": "größte Eintagesbewegung",
    "multi": "größte Bewegung über 2–5 Handelstage; längere Horizonte mit √(5/h) skaliert (Status BERECHNET_SKALIERT)",
    "substitute": "fehlende Klassen: ERSATZWERT = P-RISK-STRESS-SUBST-SHARE × ungünstigste Tageslücke der Klasse (P-GAP-*), multi = d1·√P-RISK-STRESS-MULTI-DAYS",
    "fx_chf": "FX_CHF gilt für CHF-Kontrakte (6S, MSF); FX für übrige Devisen"
  },
  "historical": [
    {
      "id": "SC-H-1987",
      "event_id": "E1987_BLACK_MONDAY",
      "name": "Aktiencrash 19.10.1987",
      "sources": [
        "SRC-STRESS-E1987-BLACK-MONDAY"
      ],
      "margin_increase": null,
      "expiring_contract_only": false,
      "margin_source": null,
      "market_structure": "Rekord-Margin-Calls (etwa das Zehnfache), Handelsaussetzungen am 20.10.",
      "moves": {
        "STIR": {
          "d1": 0.5,
          "d1_status": "BELEGT_PRIMAER",
          "multi": 1.06,
          "multi_status": "BERECHNET_SKALIERT",
          "basis": "Fed Funds −50 bp (1 T); T-Bills −150 bp über 10 T"
        },
        "ANLEIHE_KURZ": {
          "d1": null,
          "d1_status": "ERSATZWERT",
          "multi": null,
          "multi_status": "ERSATZWERT",
          "basis": "keine belegte Bewegung – Ersatzwert der Engine (halbe Konstruktionslücke)"
        },
        "ANLEIHE_MITTEL": {
          "d1": null,
          "d1_status": "ERSATZWERT",
          "multi": null,
          "multi_status": "ERSATZWERT",
          "basis": "keine belegte Bewegung – Ersatzwert der Engine (halbe Konstruktionslücke)"
        },
        "ANLEIHE_LANG": {
          "d1": null,
          "d1_status": "ERSATZWERT",
          "multi": null,
          "multi_status": "ERSATZWERT",
          "basis": "Kurs +5,2 % über 2 T belegt (Preisangabe, siehe price_pct)"
        },
        "RENDITE": {
          "d1": null,
          "d1_status": "ERSATZWERT",
          "multi": null,
          "multi_status": "ERSATZWERT",
          "basis": "keine belegte Bewegung – Ersatzwert der Engine (halbe Konstruktionslücke)"
        },
        "FX": {
          "d1": null,
          "d1_status": "ERSATZWERT",
          "multi": 1.84,
          "multi_status": "BERECHNET_SKALIERT",
          "basis": "USD −4,5 % über die FOMC-Zwischenperiode"
        },
        "FX_CHF": {
          "d1": null,
          "d1_status": "ERSATZWERT",
          "multi": null,
          "multi_status": "ERSATZWERT",
          "basis": "keine belegte Bewegung – Ersatzwert der Engine (halbe Konstruktionslücke)"
        },
        "ENERGIE": {
          "d1": null,
          "d1_status": "ERSATZWERT",
          "multi": null,
          "multi_status": "ERSATZWERT",
          "basis": "keine belegte Bewegung – Ersatzwert der Engine (halbe Konstruktionslücke)"
        },
        "EDELMETALL": {
          "d1": null,
          "d1_status": "ERSATZWERT",
          "multi": null,
          "multi_status": "ERSATZWERT",
          "basis": "keine belegte Bewegung – Ersatzwert der Engine (halbe Konstruktionslücke)"
        },
        "INDUSTRIEMETALL": {
          "d1": null,
          "d1_status": "ERSATZWERT",
          "multi": null,
          "multi_status": "ERSATZWERT",
          "basis": "keine belegte Bewegung – Ersatzwert der Engine (halbe Konstruktionslücke)"
        },
        "AGRAR": {
          "d1": null,
          "d1_status": "ERSATZWERT",
          "multi": null,
          "multi_status": "ERSATZWERT",
          "basis": "keine belegte Bewegung – Ersatzwert der Engine (halbe Konstruktionslücke)"
        },
        "VIEH": {
          "d1": null,
          "d1_status": "ERSATZWERT",
          "multi": null,
          "multi_status": "ERSATZWERT",
          "basis": "keine belegte Bewegung – Ersatzwert der Engine (halbe Konstruktionslücke)"
        },
        "SOFTS": {
          "d1": null,
          "d1_status": "ERSATZWERT",
          "multi": null,
          "multi_status": "ERSATZWERT",
          "basis": "keine belegte Bewegung – Ersatzwert der Engine (halbe Konstruktionslücke)"
        },
        "KRYPTO": {
          "d1": null,
          "d1_status": "ERSATZWERT",
          "multi": null,
          "multi_status": "ERSATZWERT",
          "basis": "keine belegte Bewegung – Ersatzwert der Engine (halbe Konstruktionslücke)"
        },
        "AKTIENINDEX": {
          "d1": 29.0,
          "d1_status": "BELEGT_PRIMAER",
          "multi": 29.0,
          "multi_status": "BELEGT_PRIMAER",
          "basis": "S&P-500-Futures −29 % (CME)"
        }
      },
      "extra": {
        "ANLEIHE_LANG_price_pct_multi": 5.2
      }
    },
    {
      "id": "SC-H-1994",
      "event_id": "E1994_BOND_CRASH",
      "name": "Anleihecrash 1994",
      "sources": [
        "SRC-STRESS-E1994-BOND-CRASH"
      ],
      "margin_increase": null,
      "expiring_contract_only": false,
      "margin_source": null,
      "market_structure": "",
      "moves": {
        "STIR": {
          "d1": 0.26,
          "d1_status": "BERECHNET_PRIMAER",
          "multi": 0.34,
          "multi_status": "BERECHNET_PRIMAER",
          "basis": "UST 3M +26 bp (1 T) / +34 bp (5 T)"
        },
        "ANLEIHE_KURZ": {
          "d1": 0.36,
          "d1_status": "BERECHNET_PRIMAER",
          "multi": 0.47,
          "multi_status": "BERECHNET_PRIMAER",
          "basis": "UST 2J +36 / +47 bp"
        },
        "ANLEIHE_MITTEL": {
          "d1": 0.39,
          "d1_status": "BERECHNET_PRIMAER",
          "multi": 0.55,
          "multi_status": "BERECHNET_PRIMAER",
          "basis": "UST 10J +39 / +55 bp"
        },
        "ANLEIHE_LANG": {
          "d1": 0.32,
          "d1_status": "BERECHNET_PRIMAER",
          "multi": 0.45,
          "multi_status": "BERECHNET_PRIMAER",
          "basis": "UST 30J +32 / +45 bp"
        },
        "RENDITE": {
          "d1": 0.36,
          "d1_status": "BERECHNET_PRIMAER",
          "multi": 0.47,
          "multi_status": "BERECHNET_PRIMAER",
          "basis": "wie UST 2J"
        },
        "FX": {
          "d1": null,
          "d1_status": "ERSATZWERT",
          "multi": null,
          "multi_status": "ERSATZWERT",
          "basis": "keine belegte Bewegung – Ersatzwert der Engine (halbe Konstruktionslücke)"
        },
        "FX_CHF": {
          "d1": null,
          "d1_status": "ERSATZWERT",
          "multi": null,
          "multi_status": "ERSATZWERT",
          "basis": "keine belegte Bewegung – Ersatzwert der Engine (halbe Konstruktionslücke)"
        },
        "ENERGIE": {
          "d1": null,
          "d1_status": "ERSATZWERT",
          "multi": null,
          "multi_status": "ERSATZWERT",
          "basis": "keine belegte Bewegung – Ersatzwert der Engine (halbe Konstruktionslücke)"
        },
        "EDELMETALL": {
          "d1": null,
          "d1_status": "ERSATZWERT",
          "multi": null,
          "multi_status": "ERSATZWERT",
          "basis": "keine belegte Bewegung – Ersatzwert der Engine (halbe Konstruktionslücke)"
        },
        "INDUSTRIEMETALL": {
          "d1": null,
          "d1_status": "ERSATZWERT",
          "multi": null,
          "multi_status": "ERSATZWERT",
          "basis": "keine belegte Bewegung – Ersatzwert der Engine (halbe Konstruktionslücke)"
        },
        "AGRAR": {
          "d1": null,
          "d1_status": "ERSATZWERT",
          "multi": null,
          "multi_status": "ERSATZWERT",
          "basis": "keine belegte Bewegung – Ersatzwert der Engine (halbe Konstruktionslücke)"
        },
        "VIEH": {
          "d1": null,
          "d1_status": "ERSATZWERT",
          "multi": null,
          "multi_status": "ERSATZWERT",
          "basis": "keine belegte Bewegung – Ersatzwert der Engine (halbe Konstruktionslücke)"
        },
        "SOFTS": {
          "d1": null,
          "d1_status": "ERSATZWERT",
          "multi": null,
          "multi_status": "ERSATZWERT",
          "basis": "keine belegte Bewegung – Ersatzwert der Engine (halbe Konstruktionslücke)"
        },
        "KRYPTO": {
          "d1": null,
          "d1_status": "ERSATZWERT",
          "multi": null,
          "multi_status": "ERSATZWERT",
          "basis": "keine belegte Bewegung – Ersatzwert der Engine (halbe Konstruktionslücke)"
        },
        "AKTIENINDEX": {
          "d1": null,
          "d1_status": "ERSATZWERT",
          "multi": null,
          "multi_status": "ERSATZWERT",
          "basis": "keine belegte Bewegung – Ersatzwert der Engine (halbe Konstruktionslücke)"
        }
      },
      "extra": {}
    },
    {
      "id": "SC-H-1998",
      "event_id": "E1998_LTCM_RUSSIA",
      "name": "LTCM/Russland 1998",
      "sources": [
        "SRC-STRESS-E1998-LTCM-RUSSIA"
      ],
      "margin_increase": null,
      "expiring_contract_only": false,
      "margin_source": null,
      "market_structure": "",
      "moves": {
        "STIR": {
          "d1": 0.5,
          "d1_status": "BERECHNET_PRIMAER",
          "multi": 0.5,
          "multi_status": "BERECHNET_PRIMAER",
          "basis": "UST 3M −50 bp (1 T)"
        },
        "ANLEIHE_KURZ": {
          "d1": 0.27,
          "d1_status": "BERECHNET_PRIMAER",
          "multi": 0.43,
          "multi_status": "BERECHNET_PRIMAER",
          "basis": "UST 2J −27 / −43 bp"
        },
        "ANLEIHE_MITTEL": {
          "d1": 0.22,
          "d1_status": "BERECHNET_PRIMAER",
          "multi": 0.61,
          "multi_status": "BERECHNET_PRIMAER",
          "basis": "UST 10J +22 bp (1 T), +61 bp (4 T)"
        },
        "ANLEIHE_LANG": {
          "d1": 0.16,
          "d1_status": "BERECHNET_PRIMAER",
          "multi": 0.45,
          "multi_status": "BERECHNET_PRIMAER",